company_name,email,hiring_manager,custom_line
ABC Corp,hr@abccorp.com,Mr. Sharma,I admire ABC Corp's cloud solutions and innovative projects.
XYZ Ltd,careers@xyzltd.com,Ms. Gupta,XYZ Ltd’s scalable applications match my expertise and passion.
Tech Solutions,contact@techsolutions.com,Mr. Verma,Your backend projects excite me and align with my skills.
Innovatech,hr@innovatech.com,Ms. Singh,I am impressed by Innovatech’s contributions to AI and automation.
NextGen Software,careers@nextgensoft.com,Mr. Rao,NextGen Software’s dynamic solutions resonate with my experience.
